{
  "version": 1,
  "process": "bug",
  "updated_at": "{{CREATED_AT}}",
  "lead": "bug-lead",
  "status": "idle",
  "current_agent": null,
  "agents": {
    "triager": {
      "role": "Clarificar síntoma, repro, esperado/actual y severidad",
      "status": "idle",
      "note": null
    },
    "scribe": {
      "role": "Materializar el bug brief en memory/bugs/ tras confirmación",
      "status": "idle",
      "note": null
    }
  },
  "working": {
    "draft_title": null,
    "artifact_id": null,
    "artifact_path": null
  },
  "history": []
}
